Overview,概览,概要,개요,Présentation,Überblick,Panoramica,Descripción general,Visão geral
"Container tools that give you choice
",容器工具让您有更多的选择,豊富な選択肢を提供するコンテナツール,선택의 폭을 제공하는 컨테이너 툴,Plus de choix grâce aux outils de conteneurisation,Container-Tools mit vielen Möglichkeiten,Strumenti per container e libertà di scelta,Herramientas de contenedores que le brindan alternativas,Ferramentas de container que garantem seu poder de escolha
"Red Hat Enterprise Linux 8 offers container tools that allow you to tailor your systems to find, run, build, and share containers with other Open Container Initiative (OCI) standards-compatible tools. With this increased choice and support for containerized applications, you can implement business solutions when and how you want. ",红帽企业 Linux 8 提供容器工具，支持您定制系统，以便通过其他开放容器计划（OCI）标准兼容工具来查找、运行、构建和共享容器。凭借容器化应用带来的更多选择与支持，您可以随时按需实施业务解决方案。,Red Hat Enterprise Linux 8 のコンテナツールを使うと、コンテナの検出、実行、ビルド、およびその他の Open Container Initiative (OCI) 標準準拠のツールとの共有ができるようにシステムをカスタマイズできます。コンテナ化アプリケーションに関する選択肢が増え、サポートが強化されるので、いつでも好きな方法でビジネスソリューションを実装できます。,"Red Hat Enterprise Linux 8은 오픈 컨테이너 이니셔티브(Open Container Initiative, OCI) 표준과 호환되는 다양한 툴로 컨테이너를 검색, 실행, 구축 및 공유하도록 시스템을 맞춤 설정할 수 있는 컨테이너 툴을 제공합니다. 이처럼 선택의 유연성을 확보하고 애플리케이션 컨테이너 지원을 확대하여 원하는 때에 원하는 방식으로 비즈니스 솔루션을 구현할 수 있습니다.","Le système d'exploitation Red Hat Enterprise Linux 8 fournit des outils de conteneurisation qui vous permettent de personnaliser votre système pour trouver, exécuter, créer et partager des conteneurs avec d'autres outils compatibles avec les normes de l'OCI (Open Container Initiative). Grâce au nombre croissant d'options et à l'étendue de la prise en charge pour les applications conteneurisées, vous pouvez mettre en œuvre des solutions d'entreprise quand et comme vous le voulez.","Red Hat Enterprise Linux 8 bietet Container-Tools, mit denen Sie Ihr System so anpassen können, dass Sie damit Container suchen, ausführen, entwickeln und gemeinsam mit anderen Tools verwenden können, die mit OCI-Standards (Open Container Initiative) kompatibel sind. Dank dieser größeren Auswahl sowie zusätzlichem Support für containerisierte Anwendungen können Sie geschäftliche Lösungen jederzeit und überall implementieren.","Gli strumenti per container integrati in Red Hat Enterprise Linux 8 consentono di creare sistemi idonei a individuare, eseguire, compilare e condividere container con altri strumenti compatibili con gli standard Open Container Initiative (OCI), offrendo una più vasta opportunità di scelta e supporto per creare applicazioni containerizzate con le quali implementare le soluzioni aziendali quando e come necessario.","Red Hat Enterprise Linux 8 ofrece las herramientas de contenedores que le permiten personalizar los sistemas para buscar, ejecutar, diseñar y compartir contenedores con otras herramientas compatibles con los estándares de la Open Container Initiative (OCI). Con esta mayor variedad de opciones y compatibilidad en cuanto a las aplicaciones en contenedores, usted puede implementar soluciones empresariales cuando y como lo desee.","As ferramentas de container do Red Hat Enterprise Linux 8 permitem que você personalize seus sistemas para localizar, executar e compartilhar containers com ferramentas compatíveis com os padrões da Open Container Initiative (OCI). Com mais opções de escolha e suporte ampliado para aplicações em containers, você pode implementar soluções empresariais quando e como quiser."
Join the developer community,加入开发人员社区,開発者コミュニティに参加する,개발자 커뮤니티 참여하기,Rejoindre la communauté des développeurs,Werden Sie Mitglied der Entwickler-Community,Entra a far parte della community di sviluppatori,Intégrese a la comunidad de desarrolladores,Junte-se à comunidade de desenvolvedores
Podman,Podman,Podman,Podman,Podman,Podman,Podman,Podman,Podman
"
Use Podman for running containers.

Podman is a daemon-less command-line tool that lets you directly create and manage container images. By letting you work with containers without the need for a runtime environment, you can more tightly control the permissions granted to software components. 
",使用 Podman 来运行容器。  Podman 是一个无守护进程的命令行工具，支持您直接创建和管理容器镜像。通过在不需要运行时环境的情况下使用容器，您可以实现对软件组件授权的更严格控制。,"Podman はコンテナの実行に使用します。

Podman はデーモン不要のコマンドラインツールで、コンテナイメージを直接作成および管理できます。ランタイム環境がなくてもコンテナを操作できるため、ソフトウェア・コンポーネントに付与された権限をより細かく制御できます。","Podman을 사용하여 컨테이너 실행  Podman은 데몬이 없는(daemon-less) 명령줄 툴로서, 사용자가 직접 컨테이너 이미지를 생성하고 관리할 수 있도록 합니다. 런타임 환경 없이 컨테이너로 작업할 수 있으므로 소프트웨어 구성 요소에 부여한 권한을 보다 엄격하게 관리할 수 있습니다.","Utilisez Podman pour l'exécution des conteneurs.  Podman est un outil en ligne de commande sans démon qui vous permet de créer et gérer directement des images de conteneurs. En travaillant avec des conteneurs sans environnement d'exécution, vous pouvez assurer une surveillance plus étroite des autorisations accordées aux composants logiciels.","Nutzen Sie Podman zur Ausführung von Containern.  Podman ist ein Befehlszeilen-Tool ohne Daemon, mit dem Sie Container-Images direkt erstellen und verwalten können. Und weil Sie hier zum Arbeiten mit Containern keine Laufzeitumgebung benötigen, können Sie die Berechtigungen für Softwarekomponenten besser kontrollieren.",Usa Podman per eseguire i container.  Podman è uno strumento a riga di comando daemon-less per creare e gestire direttamente immagini dei container. Non richiede un ambiente di runtime e consente quindi un controllo più rigido delle autorizzazioni concesse ai componenti software.,"Utilice Podman para ejecutar contenedores.  Podman es una herramienta de línea de comandos sin daemon que le permite crear y gestionar imágenes en contenedores de forma directa. Al poder trabajar con contenedores sin la necesidad de un entorno de tiempo de ejecución, puede ejercer un control más estricto sobre los permisos otorgados a los elementos de software.","Use o Podman para executar containers.  Podman é uma ferramenta de linha de comando sem daemon que permite criar e gerenciar imagens de container diretamente. Ao permitir o trabalho com containers sem precisar de um ambiente de execução, você pode controlar melhor as permissões concedidas aos componentes de software."
Buildah,Buildah,Buildah,Buildah,Buildah,Buildah,Buildah,Buildah,Buildah
"Use Buildah for building containers.

Buildah is a build tool that gives you control over how image layers are committed and how data is accessed during builds. No container runtime is needed to use Buildah and root access is not required. 

Buildah doesn’t include build tools within the image itself, which reduces the size of the images you build.
",使用 Buildah 来构建容器。  Buildah 是一个构建工具，支持您在构建期间对镜像层的运行方式和数据的访问方式实施控制。使用 Buildah 不需要容器运行时，也不需要根访问。   Buildah 不包括镜像本身的内部构建工具，从而降低您所构建镜像的大小。,"Buildah はコンテナのビルドに使用します。

Buildah はビルドツールで、イメージレイヤーをどのようにコミットし、ビルド中にデータにどのようにアクセスするかを制御できます。Buildah の使用にはコンテナランタイムも root アクセス権も不要です。 

Buildah を使用する場合、イメージ自体にビルドツールが組み込まれないため、ビルドするイメージのサイズが小さくなります。","Buildah를 사용하여 컨테이너 구축  Buildah는 이미지 레이어가 커밋되는 방식과 빌드 도중 데이터 액세스 방식을 제어할 수 있도록 지원하는 빌드 툴입니다. Buildah를 사용하기 위해 컨테이너 런타임이 필요하지 않으며 루트 액세스도 요구되지 않습니다.   Buildah는 이미지 자체 내에 빌드 툴을 포함하지 않으므로, 구축하는 이미지의 크기를 줄여줍니다.","Utilisez Buildah pour la création des conteneurs.  Buildah est un outil de création qui vous permet de définir la validation des couches d'images et l'accès aux données pendant la création. Avec Buildah, vous n'avez pas besoin d'environnement d'exécution pour les conteneurs ni d'accès root.   Buildah n'intègre pas d'outils de création dans les images elles-mêmes, ce qui réduit leur taille.","Nutzen Sie Buildah zur Entwicklung von Containern.  Buildah ist ein Entwicklungs-Tool, mit dem Sie steuern können, wie viele Image-Schichten implementiert werden und wie während des Entwicklungsprozesses auf Daten zugegriffen wird. Für dieses Tool benötigen Sie weder eine Container Runtime noch Root Access.   Da mit Buildah keine Build Tools in das Image integriert werden, lässt sich dessen Größe deutlich verringern.","Usa Buildah per creare i container.  Buildah è uno strumento che offre il controllo sulla convalida dei livelli di immagine e sull'accesso ai dati durante le compilazioni. Per l'impiego di Buildah non sono necessari runtime per container né accesso root.   Il prodotto non include nell'immagine gli strumenti di compilazione, garantendo dimensioni contenute dell'immagine creata.","Utilice Buildah para crear contenedores.  Buildah es una herramienta de creación que le permite controlar cómo se disponen las capas de imágenes y se accede a los datos durante las creaciones. Para utilizar este programa, no se requiere acceso raíz ni ningún tiempo de ejecución de contenedor.   Buildah no incluye herramientas de creación dentro de la imagen misma, lo cual reduce el tamaño de las imágenes que usted diseña.","Use o Buildah para criar containers.  Buildah é uma ferramenta de build que oferece controle sobre como as camadas de imagens são compostas e como os dados são acessados durante as compilações. Para usar o Buildah, não é necessário ter um ambiente de execução de containers nem acesso raiz.   O Buildah não inclui ferramentas de build na imagem em si, o que reduz o tamanho das imagens criadas."
Skopeo,Skopeo,Skopeo,Skopeo,Skopeo,Skopeo,Skopeo,Skopeo,Skopeo
"
Use Skopeo for finding and sharing containers.

Skopeo is a flexible utility that enables moving, signing, and verifying of images between registry servers and container hosts. You can use Skopeo to inspect images outside of your system
",使用 Skopeo 来查找和共享容器。  Skopeo 是一个灵活的实用程序，可在注册表服务器和容器主机之间迁移、签名和验证镜像。您可以使用 Skopeo 来检查系统外部镜像,"Skopeo はコンテナの検出と共有に使用します。

Skopeo は柔軟なユーティリティで、レジストリサーバーとコンテナホスト間でのイメージの移動、署名、検証を実現します。システム外部のイメージの検査もできます。","Skopeo를 사용하여 컨테이너 검색 및 공유  Skopeo는 레지스트리 서버와 컨테이너 호스트 간에 이미지를 이동, 서명 및 검증할 수 있도록 지원하는 유연한 유틸리티입니다. Skopeo를 사용하여 시스템 외부 이미지를 검사할 수 있습니다.","Utilisez Skopeo pour la recherche et le partage des conteneurs.  Skopeo est un utilitaire flexible qui permet le déplacement, la signature et la vérification des images entre les serveurs de registre et les hôtes de conteneur. Vous pouvez utiliser Skopeo pour examiner des images en dehors de votre système.","Nutzen Sie Skopeo für die Suche nach sowie die gemeinsame Verwendung von Containern.  Skopeo ist ein flexibles Dienstprogramm, mit dem Sie Images zwischen Registry-Servern und Container Hosts verschieben, signieren und verifizieren können. Dazu lassen sich damit Images außerhalb Ihres Systems inspizieren.","Skopeo consente di individuare e condividere i container.  È uno strumento flessibile per lo spostamento, la firma e la verifica delle immagini tra server di registro e host di container e permette anche di ispezionare immagini esterne ai sistemi in uso.","Utilice Skopeo para buscar y compartir contenedores.  Skopeo es una herramienta flexible que permite trasladar, firmar y verificar imágenes entre los servidores de registros y los hosts de contenedores. Utilice Skopeo para examinar imágenes fuera de su sistema","Use o Skopeo para localizar e compartilhar containers.  Skopeo é um utilitário flexível que permite a migração, assinatura e verificação de imagens entre servidores de registro e hosts de containers. O Skopeo pode ser usado para inspecionar imagens fora do seu sistema"
"Streamline your process
",简化您的流程,プロセスの効率化,프로세스의 간소화,Des processus rationalisés,Optimieren Sie Ihre Prozesse,Ottimizza i processi,Optimice el proceso,Simplifique seu processo
"Your apps never stop. Neither will your OS. With Red Hat Enterprise Linux 8, you can spend more time delivering business value and less time manually managing the underlying infrastructure. Quickly on-board non-Linux users using the web console, easily update apps using application streams, and stay focused on compliance and security with the built-in controls of Red Hat Enterprise Linux 8. ",您的应用再也不会停止运行。同样，您的操作系统再也不会停止运行。有了红帽企业 Linux 8，您可投入更多时间用于交付业务价值，并减少手动管理底层基础架构的时间。非 Linux 用户可通过 Web 控制台实现快速登录，轻松通过应用流更新应用，并通过红帽企业 Linux 8 内置控件保障合规性与安全性。,止まらないアプリ。止まらない OS。Red Hat Enterprise Linux 8 を使用すれば、インフラを手動で管理する時間を減らし、より多くの時間をビジネス価値を提供するための仕事に使うことができます。Red Hat Enterprise Linux 8 は、Linux に慣れていないユーザーでもすばやく利用を開始できる Web コンソール、アプリケーションを簡単にアップデートできるアプリケーション・ストリーム、コンプライアンス遵守とセキュリティ保護に集中できる組み込みの制御機能など、豊富な機能を備えています。,"애플리케이션은 실행이 중단되어서는 안되며  OS도 항상 실행되어야 합니다. Red Hat Enterprise Linux 8을 사용하면 비즈니스 가치 실현 및 기반 인프라의 수동 관리에 소요되는 시간을 더욱 단축시킬 수 있습니다. Red Hat Enterprise Linux 8의 빌트인 제어는 새로운 Linux 사용자가 웹 콘솔을 통해 신속하게 적응할 수 있도록 지원하고, 애플리케이션 스트림을 사용하여 간편하게 애플리케이션을 업데이트하며, 규정 준수 및 보안에 집중할 수 있도록 지원합니다.","Vos applications ne s'arrêtent jamais. Votre système d'exploitation non plus. Avec Red Hat Enterprise Linux 8, vous pouvez réduire le temps consacré à la gestion manuelle de la structure sous-jacente pour vous focaliser sur la création de valeur. Sous Red Hat Enterprise Linux 8, les utilisateurs qui découvrent Linux pourront très rapidement prendre leurs marques grâce à la console web, et vous pourrez mettre à jour facilement vos applications à l'aide des flux d'applications tout en assurant la conformité et la sécurité avec les commandes intégrées.","Ihre Apps sind im Dauerbetrieb. Gleiches gilt für Ihr Betriebssystem. Mit Red Hat Enterprise Linux 8 haben Sie mehr Zeit für die Bereitstellung geschäftlicher Werte und reduzieren gleichzeitig den Aufwand für die manuelle Verwaltung der zugrundeliegenden Infrastruktur. Mit ihm können Sie ein einfaches und schnelles Onboarding neuer Linux-Benutzer über die Webkonsole realisieren, Anwendungen mithilfe von Application Streams auf einfachste Weise aktualisieren und dank seiner integrierten Kontrollen auf Compliance und Sicherheit fokussieren.","Le tue app devono essere efficienti, così come il tuo sistema operativo. Con Red Hat Enterprise Linux 8 puoi dedicare il tuo tempo a creare valore per il tuo business, senza doverti occupare di gestire manualmente l'infrastruttura. Garantisci l'operatività degli utenti che non hanno ancora familiarità con Linux attraverso l'utilizzo della console web; aggiorna facilmente le app con i flussi delle applicazioni e garantisci compliance e sicurezza con i controlli integrati di Red Hat Enterprise Linux 8.","Las aplicaciones nunca se detienen, y tampoco lo hará el sistema operativo. Con Red Hat Enterprise Linux 8, puede invertir más tiempo en aportar valor empresarial y menos en administrar la infraestructura subyacente de forma manual. Incorpore usuarios que no estén familiarizados con Linux rápidamente utilizando la consola web, actualice aplicaciones con facilidad usando flujos de aplicaciones y manténgase enfocado en el cumplimiento y la seguridad con los controles integrados de Red Hat Enterprise Linux 8.","Suas aplicações nunca param. O sistema operacional também não. Com o Red Hat Enterprise Linux 8, você pode se concentrar em agregar mais valor corporativo e investir menos tempo com o gerenciamento manual da infraestrutura subjacente. Ao fornecer um console da web simplificado, os novos usuários de Linux conseguem rapidamente atualizar aplicações com facilidade usando o fluxo de aplicações, além de garantir a conformidade e a segurança com os controles integrados do Red Hat Enterprise Linux 8."
Get the technical brief for sysadmins,获取系统管理员的技术简介,システム管理者向けの技術概要を読む,시스템 관리자를 위한 기술 개요 보기,Télécharger l'analyse technique de sysadmins,Zur technischen Übersicht für Systemadministratoren,Informazioni tecniche per amministratori di sistema,Obtenga el informe técnico para administradores de sistemas,Obtenha o resumo técnico para administradores de sistema
Application streams,应用流,アプリケーション・ストリーム,애플리케이션 스트림,Flux d'applications,Application Streams,Flussi delle applicazioni,Flujos de aplicaciones,Fluxo de aplicações
"Now, you can offer the apps that developers want, independent of OS releases. Use application streams to separate applications from the base OS so you can update apps without having to wait for the next major version of the operating system. 
",从现在开始，您可以为开发人员提供所需要的应用，同时保持操作系统发布的独立性。 借助应用流能将应用与基本操作系统分开，可以随时更新应用，而不需等待操作系统的下一个主要版本。,OS のリリースにかかわらず、開発者が求めるアプリケーションを提供できるようになりました。アプリケーション・ストリームを使用すると、アプリケーションをベース OS から切り離せるため、オペレーティングシステムの次のメジャーバージョンまで待たずとも、アプリケーションのアップデートが可能です。,이제 OS 버전과 상관없이 개발자가 원하는 애플리케이션을 제공할 수 있습니다. 애플리케이션 스트림을 사용하여 애플리케이션을 기본 OS와 분리하면 다음 주요 OS 버전을 기다릴 필요 없이 애플리케이션을 업데이트할 수 있습니다.,"Vous pouvez désormais offrir les applications que les développeurs réclament, quelle que soit la version du système d'exploitation. En séparant les applications du système d'exploitation de base à l'aide des flux d'applications, vous pouvez mettre à jour les applications sans attendre la prochaine version majeure du système d'exploitation.","Jetzt können Sie Ihren Entwickler unabhängig vom OS-Release stets die gewünschten Apps zur Verfügung stellen. Mit Application Streams lassen sich Anwendungen zwecks Aktualisierung vom Haupt-Betriebssystem separieren, ohne auf das nächste Major Release des OS warten zu müssen.","Grazie ai flussi delle applicazioni puoi offrire agli sviluppatori le versioni dell'app che preferiscono, a prescindere dalla release del sistema operativo, I flussi consentono infatti di separare le applicazioni dal sistema operativo, per aggiornarle senza dover attendere le successive versioni del sistema.","Ahora puede ofrecer las aplicaciones que los desarrolladores buscan, independientemente de las versiones del sistema operativo. Utilice flujos de aplicaciones para separar las aplicaciones del sistema operativo base, de forma tal que pueda actualizarlas sin tener que esperar a que salga la próxima versión principal de este.","Com o fluxo de aplicações, você pode oferecer as aplicações que os desenvolvedores precisam, independentemente das versões do sistema operacional. Use o fluxo de aplicações para separar aplicações do sistema operacional. Assim, você pode atualizar aplicações sem precisar esperar a próxima versão principal do sistema operacional."
Web console,Web 控制台,Web コンソール,웹 콘솔,Console web,Webkonsole,Console web,Consola web,Console da web
